{
  "archetypeId": "station",
  "displayName": "小镇车站",
  "background": {
    "style": "gradient",
    "gradient": "linear-gradient(#e8ecf2 0%, #cfd8e3 55%, #8a94a6 56%, #6b7588 100%)",
    "decor": ["bench"],
    "ambienceKey": "ambience/station_loop.ogg"
  },
  "zones": {
    "platform": { "x": [80, 920], "y": [420, 820], "anchor": "bottom" }
  },
  "propSlots": [
    { "slotId": "platform.bench", "zone": "platform", "categories": ["furniture", "paper"] }
  ],
  "npcSlots": [ { "slotId": "conductor", "zone": "platform", "role": "conductor" } ],
  "exits": [
    { "direction": "left", "targetKind": "any" },
    { "direction": "right", "targetKind": "any" }
  ]
}
